<?xml version="1.0"?>
<bugs xmlns:xsi="http://www.w3.org/2001/XMLSchema-instance"
    xsi:noNamespaceSchemaLocation="bugs.xsd">

    <bug status="open">
        <submit-date>2012-09-03T13:15:00</submit-date>
        <description>Unable to set images as background</description>
    </bug>

    <bug status="closed">
        <submit-date>2012-09-11T14:43:00</submit-date>
        <description>The File dialog does not update when a new folder is created</description>
        <close-date>2012-09-28T00:03:00</close-date>
    </bug>

</bugs>
